{
  "$schema": "./project.schema.json",
  "project": {
    "id": "exnoria",
    "name": "Xnoria CX Intelligence Engine",
    "version": "1.3.0",
    "environment": "development"
  },
  "branding": {
    "title": "Xnoria CX Dock",
    "subtitle": "",
    "logo_url": "/logo.svg",
    "primary_color": "#0F172A"
  },
  "enabled_stages": ["ACQ", "SAL", "ONB", "PRD", "SUP", "COM", "RET", "EXP"],
  "llm_defaults": {
    "coordinator_model": "llama-3.1-8b-instant",
    "acqsal_model": "llama-3.3-70b-versatile",
    "lifecycle_model": "claude-sonnet-4-6",
    "escalation_model": "claude-sonnet-4-6"
  }
}
